{
  "$schema": "http://json-schema.org/draft-07/schema#",
  "$id": "https://github.com/nguyenvanphituoc/shapeup-sdlc-plugin/schemas/gate-answers.schema.json",
  "title": "GateAnswerSet",
  "description": "A pre-recorded set of PO decisions, one per gate, that lets a run cross its gates without a human in the loop. This is NOT 'gates off' — every gate still emits its block and still records a decision in the ledger; the decision's SOURCE becomes this file instead of a live human. That distinction is the whole design: an unattended run with no answer set stalls at the first ⏸ and burns its whole wall-clock budget having built nothing, while an unattended run with one produces the same audit trail an interactive run does.",
  "type": "object",
  "required": ["version", "preset", "answers"],
  "additionalProperties": false,
  "properties": {
    "version": { "const": 1 },
    "preset": {
      "type": "string",
      "enum": ["ci", "guarded", "interactive", "custom"],
      "description": "Provenance of this set. 'ci' = every gate pre-approved (headless); 'guarded' = low-risk gates pre-approved, judgment gates still ask; 'interactive' = nothing pre-approved (the default lane); 'custom' = hand-authored."
    },
    "authorized_by": {
      "type": "string",
      "description": "Who pre-approved these decisions. Free text, recorded verbatim in the round ledger so a shipped run can always name the human behind its sign-off."
    },
    "on_missing": {
      "type": "string",
      "enum": ["ask", "proceed", "abort"],
      "default": "ask",
      "description": "What to do at a gate this set has no answer for. 'abort' is the correct value for headless lanes: a fast attributable failure beats a silent stall that reads as a slow run."
    },
    "escalation": {
      "type": "object",
      "additionalProperties": false,
      "description": "RESERVED. Policy for a worker-raised question, which would be a gate in all but name. Inert today: WorkResult carries no escalates field, so no worker can raise one. Kept as a declared key because the answer-set schema forbids additional properties, and removing it would invalidate every gate-answers.json already on disk.",
      "properties": {
        "default": {
          "type": "string",
          "enum": ["ask", "assume-and-record", "abort"],
          "default": "ask"
        },
        "budget_per_scope_per_round": { "type": "integer", "minimum": 0, "default": 2 }
      }
    },
    "answers": {
      "type": "object",
      "description": "Gate id → decision. Ids match the ⏸ GATE blocks the orchestrator emits.",
      "additionalProperties": false,
      "properties": {
        "L0":     { "$ref": "#/definitions/answer" },
        "L1a":    { "$ref": "#/definitions/answer" },
        "L1a.5":  { "$ref": "#/definitions/answer" },
        "L1b":    { "$ref": "#/definitions/answer" },
        "L2":     { "$ref": "#/definitions/answer" },
        "L3":     { "$ref": "#/definitions/answer" },
        "QA":     { "$ref": "#/definitions/answer" },
        "H":      { "$ref": "#/definitions/answer" },
        "L4":     { "$ref": "#/definitions/answer" },
        "COACH-1":{ "$ref": "#/definitions/answer" }
      }
    }
  },
  "definitions": {
    "answer": {
      "type": "object",
      "required": ["decision"],
      "additionalProperties": false,
      "properties": {
        "decision": {
          "type": "string",
          "enum": [
            "proceed",
            "ask",
            "abort",
            "loop",
            "stop",
            "ship",
            "hold",
            "accept-cut-list",
            "ship-all",
            "run",
            "skip"
          ],
          "description": "proceed/ask/abort apply to review gates (L0, L1a, L1a.5, L1b, L2). L3 takes loop|stop|ask. QA takes run|skip. H takes accept-cut-list|ship-all|ask. L4 takes ship|hold|ask. COACH-1 takes skip|ask."
        },
        "note": {
          "type": "string",
          "description": "Recorded in the ledger next to the decision. This is where the pre-approval's reasoning lives, and it is the difference between an audited bypass and a rubber stamp."
        },
        "max_rounds": {
          "type": "integer",
          "minimum": 1,
          "description": "L3 only — caps the loop decision. Redundant with the run config on purpose: an answer set handed to a run must not be able to authorize more rounds than it names."
        }
      }
    }
  }
}
